{
  "name": "mission-control",
  "version": "2.8.0",
  "description": "SDLC management for Operations, Asgard, and CAMPPS: Antigravity-native state, prepared issue drafts, live schema sync, board schemas, labels, project fields, metrics, and card validation.",
  "keywords": ["campps", "github", "sdlc"]
}
