{
  "name": "fleet-core",
  "version": "0.9.0",
  "description": "Fleet-commons library plugin: shared primitives, the Antigravity capability and host contract, and the canonical vendored resolution shim. Scripts-only — no skills, commands, or agents.",
  "author": {
    "name": "Infiquetra",
    "email": "hello@infiquetra.com"
  },
  "repository": "https://github.com/infiquetra/infiquetra-antigravity-plugins",
  "keywords": [
    "fleet-commons",
    "shared-primitives",
    "tier-palette",
    "tier-resolver",
    "library"
  ]
}
