{
  "name": "multi-agent-consensus",
  "version": "2.3.0",
  "description": "Native Antigravity multi-agent consensus workflow with capability-gated agent and isolation contracts, parallel workers and reviewers, scoring, and nonprod validator-driven fix routing.",
  "author": {
    "name": "Infiquetra",
    "email": "hello@infiquetra.com"
  },
  "repository": "https://github.com/infiquetra/infiquetra-antigravity-plugins",
  "keywords": [
    "multi-agent",
    "consensus",
    "code-review",
    "reviewers",
    "antigravity",
    "validators",
    "automation",
    "nonprod"
  ]
}
