{
  "name": "infiquetra-deploy",
  "version": "0.1.0",
  "description": "tag-promotion deployment operations for Infiquetra repositories.",
  "author": {
    "name": "Infiquetra",
    "email": "hello@infiquetra.com"
  },
  "repository": "https://github.com/infiquetra/infiquetra-claude-plugins",
  "keywords": [
    "deploy",
    "tag-promotion",
    "rollback",
    "hotfix",
    "release-notes",
    "infiquetra"
  ]
}
