{
  "name": "splunk",
  "version": "1.0.0",
  "description": "Splunk log search and analysis for Infiquetra operations with natural language query building",
  "author": {
    "name": "Infiquetra Team",
    "email": "hello@infiquetra.com"
  },
  "repository": "https://github.com/infiquetra/infiquetra-antigravity-plugins",
  "keywords": [
    "splunk",
    "logs",
    "search",
    "observability",
    "monitoring",
    "spl"
  ]
}
