{
  "name": "todoist-manager",
  "version": "2.1.0",
  "description": "Full Todoist integration for natural-language task management, task readiness review, daily planning workflows, and productivity coaching through Claude Code conversations",
  "author": {
    "name": "Jeff Cox",
    "email": "hello@infiquetra.com"
  },
  "repository": "https://github.com/infiquetra/infiquetra-antigravity-plugins",
  "keywords": [
    "todoist",
    "task-management",
    "productivity",
    "planning",
    "gtd",
    "personal",
    "task-review",
    "readiness",
    "plan-task"
  ]
}
