{
  "name": "python-toolkit",
  "version": "1.0.0",
  "description": "Python development toolkit for Infiquetra projects (project setup, testing, Cox patterns)",
  "author": {
    "name": "Infiquetra Team",
    "email": "hello@infiquetra.com"
  },
  "repository": "https://github.com/infiquetra/infiquetra-antigravity-plugins",
  "keywords": [
    "python",
    "testing",
    "development",
    "cox",
    "patterns"
  ]
}
