{
  "name": "pagerduty",
  "version": "1.0.0",
  "description": "PagerDuty incident management, service CRUD, team management, and on-call orchestration for Infiquetra operations",
  "author": {
    "name": "Infiquetra Team",
    "email": "hello@infiquetra.com"
  },
  "repository": "https://github.com/infiquetra/infiquetra-antigravity-plugins",
  "keywords": [
    "pagerduty",
    "incident-management",
    "on-call",
    "alerting",
    "operations",
    "sre"
  ]
}
