{
  "name": "unifi",
  "version": "1.0.0",
  "description": "UniFi Network and Protect CLI for managing UDM devices, clients, VLANs, firewall rules, cameras, PTZ control, and motion events",
  "author": {
    "name": "Infiquetra",
    "email": "hello@infiquetra.com"
  },
  "repository": "https://github.com/infiquetra/infiquetra-antigravity-plugins",
  "keywords": [
    "unifi",
    "ubiquiti",
    "network",
    "protect",
    "cameras",
    "home-lab",
    "udm",
    "firewall",
    "vlan"
  ]
}
