{
  "name": "docs-generator",
  "version": "2.0.0",
  "description": "Automated documentation generation for Infiquetra services",
  "author": {
    "name": "Infiquetra Team",
    "email": "hello@infiquetra.com"
  },
  "repository": "https://github.com/infiquetra/infiquetra-antigravity-plugins",
  "keywords": [
    "documentation",
    "openapi",
    "diagrams",
    "automation"
  ]
}
