{
  "name": "marketplace-lister",
  "version": "3.0.0",
  "description": "Identify items from photos and generate multi-platform listings for Facebook Marketplace, Mercari, and eBay with full eBay API integration.",
  "author": {
    "name": "Infiquetra",
    "email": "hello@infiquetra.com"
  },
  "repository": "https://github.com/infiquetra/infiquetra-antigravity-plugins",
  "keywords": [
    "marketplace",
    "selling",
    "photos",
    "listings",
    "facebook",
    "mercari",
    "ebay",
    "shipping",
    "api"
  ]
}
