{
  "name": "team-execution",
  "version": "1.5.0",
  "description": "Two-phase plan execution with multi-reviewer consensus. Auto-suggests on non-trivial plans, plus /team-setup wizard for tmux + Claude settings.",
  "author": {
    "name": "Infiquetra",
    "email": "hello@infiquetra.com"
  },
  "repository": "https://github.com/infiquetra/infiquetra-antigravity-plugins",
  "keywords": [
    "team-execution",
    "plan-execution",
    "code-review",
    "consensus",
    "reviewers"
  ]
}
