{
  "name": "blueprint-reviewer",
  "version": "0.1.0",
  "description": "Rubric-driven review for upstream-of-PR Infiquetra SDLC phases: blueprint sections, ADRs, specs, and GitHub issues. Complements home-lab orchestrator's plan/PR review.",
  "author": {
    "name": "Infiquetra",
    "email": "hello@infiquetra.com"
  },
  "repository": "https://github.com/infiquetra/infiquetra-antigravity-plugins",
  "keywords": [
    "blueprint",
    "spec",
    "issue",
    "reviewer",
    "rubrics",
    "sdlc",
    "ideation",
    "fidelity",
    "devils-advocate",
    "mount-olympus"
  ]
}
