{
  "name": "sdlc-manager",
  "version": "1.4.0",
  "description": "SDLC management for Mount Olympus: Kanban boards, issues, labels, flow metrics, milestones, project fields, sub-issues, and card validation.",
  "author": {
    "name": "Infiquetra",
    "email": "hello@infiquetra.com"
  },
  "repository": "https://github.com/infiquetra/infiquetra-antigravity-plugins",
  "keywords": [
    "sdlc",
    "github-projects",
    "kanban",
    "issues",
    "labels",
    "metrics",
    "milestones",
    "sub-issues",
    "card-validator",
    "mount-olympus"
  ]
}
