{
  "name": "sdk-lifecycle",
  "version": "2.0.0",
  "description": "SDK development lifecycle management for multi-language projects",
  "author": {
    "name": "Infiquetra Team",
    "email": "hello@infiquetra.com"
  },
  "repository": "https://github.com/infiquetra/infiquetra-antigravity-plugins",
  "keywords": [
    "sdk",
    "scaffolding",
    "security",
    "documentation",
    "python",
    "dotnet"
  ]
}
